{
  "task_type": "content_analysis",
  "summary": {
    "video_objective": "direct_conversion",
    "format_type": "ugc_testimonial_demo",
    "product_category": "beauty_skincare",
    "audience_guess": "young skincare shoppers looking for an easy glow-enhancing product that feels lightweight and gives a visible fresh-skin payoff",
    "main_promise": "this serum quickly makes skin look more hydrated, fresh, and glowy without feeling heavy",
    "overall_assessment": "The video is commercially solid because it gets into a relatable skincare pain point fast, shows the product early, and uses creator-led demo as proof. Its biggest upside is natural-feeling relevance plus visible use. Its biggest limitation is that the proof remains impression-based rather than strongly comparative, so some skeptical viewers may still want a clearer before-and-after payoff."
  },
  "section_breakdown": [
    {
      "section_id": "hook",
      "section_name": "Hook and problem recognition",
      "start_time": "0:00",
      "end_time": "0:03",
      "purpose": "Stop the scroll by calling out a familiar skincare frustration and signaling relevance immediately.",
      "what_is_shown": "Creator speaking directly to camera with low-friction selfie framing, visually presenting normal dull-looking skin before using the product.",
      "what_is_said": "A complaint or frustration about skin looking dull, tired, or dry.",
      "belief_shift_target": "Make the viewer feel seen and think this video may solve a relevant problem.",
      "effectiveness_note": "This section works because it is category-native, fast, and personally relatable. It creates audience relevance without long setup."
    },
    {
      "section_id": "product_reveal",
      "section_name": "Product introduction",
      "start_time": "0:03",
      "end_time": "0:06",
      "purpose": "Make the product immediately understandable and position it as the answer to the problem just introduced.",
      "what_is_shown": "Creator holds the serum bottle clearly in frame and begins introducing it.",
      "what_is_said": "The serum is presented as the product the creator uses for hydration and glow.",
      "belief_shift_target": "Move the viewer from problem recognition to solution awareness.",
      "effectiveness_note": "The product appears early enough to preserve clarity. This helps prevent the video from feeling vague or too editorial."
    },
    {
      "section_id": "demo",
      "section_name": "Application demo",
      "start_time": "0:06",
      "end_time": "0:11",
      "purpose": "Show the product in use and reduce friction around texture, routine fit, and ease of application.",
      "what_is_shown": "Creator applies the serum on skin, showing texture and hand-product interaction.",
      "what_is_said": "The creator may mention how lightweight or easy it feels.",
      "belief_shift_target": "Help the viewer believe the product is simple to use and fits naturally into a skincare routine.",
      "effectiveness_note": "This section is strong because it converts abstract product benefit into visible use. It also helps answer likely objections about greasiness or heaviness."
    },
    {
      "section_id": "proof_reaction",
      "section_name": "Result and creator reaction",
      "start_time": "0:11",
      "end_time": "0:15",
      "purpose": "Deliver the emotional and visual payoff that makes the product feel worth trying.",
      "what_is_shown": "Closer look at skin after application, with creator reacting positively to the glow or finish.",
      "what_is_said": "A positive reaction about how fresh, hydrated, or glowy the skin looks.",
      "belief_shift_target": "Increase trust by showing an immediate visible result and a believable creator response.",
      "effectiveness_note": "This is the strongest selling section because it combines visual result and testimonial energy. However, the proof remains soft unless the change is very visible."
    },
    {
      "section_id": "cta",
      "section_name": "Direct CTA close",
      "start_time": "0:15",
      "end_time": "0:18",
      "purpose": "Turn positive attention and belief into an immediate action.",
      "what_is_shown": "Product remains visible, likely with creator still on camera or with a clear end frame.",
      "what_is_said": "A simple invitation to tap, shop, or check it out.",
      "belief_shift_target": "Move the viewer from interest to action with minimal friction.",
      "effectiveness_note": "The CTA is commercially appropriate because it is simple and follows a completed mini-proof arc. It could be stronger if tied more directly to the main benefit."
    }
  ],
  "hook_analysis": {
    "hook_type": "pain_first_creator_relatable",
    "opening_visual": "Direct-to-camera creator framing with a natural, relatable presentation of the problem state.",
    "opening_message": "A complaint about dull, tired, or dry-looking skin.",
    "attention_mechanisms": [
      "problem recognition",
      "audience relevance",
      "creator authenticity",
      "fast context"
    ],
    "clarity_score": 8.7,
    "relevance_score": 9.0,
    "curiosity_or_tension_score": 7.3,
    "mute_viewing_strength": "moderate",
    "strengths": [
      "The opening quickly signals that the video is about a visible and familiar skincare problem.",
      "The creator-led framing feels native to TikTok-style content rather than overproduced advertising.",
      "The pain point is practical and easy for the target audience to recognize."
    ],
    "weaknesses": [
      "The hook likely depends partly on audio or caption comprehension rather than strong visual contrast alone.",
      "It may be more relatable than surprising, which means scroll-stopping power could be solid but not exceptional in a crowded feed.",
      "If the opening skin-state visual is subtle, some viewers may not feel enough immediate tension."
    ],
    "retention_risk_note": "The biggest hook risk is not irrelevance but insufficient visual drama. If the opening looks too ordinary, some viewers may not stay long enough for the product reveal.",
    "improvement_priority": "Increase visual contrast in the first 1–2 seconds, such as clearer dull-versus-glow expectation or stronger text support."
  },
  "selling_point_analysis": {
    "main_selling_point": "The serum gives skin a fresh, hydrated, glowy look quickly and easily.",
    "supporting_selling_points": [
      "It feels lightweight rather than heavy.",
      "It fits naturally into a daily routine.",
      "It creates a visible finish that looks appealing on camera and in real life."
    ],
    "feature_statements": [
      "serum format",
      "dropper bottle",
      "fast-absorbing texture"
    ],
    "benefit_statements": [
      "skin looks more hydrated",
      "skin looks fresher",
      "glow payoff is easy to achieve",
      "does not appear difficult or high-maintenance to use"
    ],
    "emotional_payoffs": [
      "feeling more put-together",
      "feeling more confident in natural skin",
      "feeling like the routine is easy but effective"
    ],
    "message_hierarchy_quality": "strong",
    "clarity_note": "The video stays fairly focused on one dominant promise: visible glow plus hydration with easy use. Supporting points reinforce that message rather than distracting from it.",
    "memorability_note": "Viewers are most likely to remember that this is a serum that helps dull skin look fresher and glowier quickly."
  },
  "proof_analysis": {
    "proof_types_used": [
      "live_demo",
      "creator_testimony",
      "reaction",
      "detail_close_up",
      "use_case_demo"
    ],
    "proof_strength": "moderate",
    "best_proof_moment": "The post-application skin look combined with the creator's immediate positive reaction.",
    "proof_timing_note": "Proof appears at a good time because it follows the product reveal quickly and does not make the viewer wait too long.",
    "proof_relevance_note": "The proof directly supports the main promise of hydration and glow, but it is still subjective and may not fully satisfy skeptical viewers who want stronger visible contrast.",
    "proof_gaps": [
      "No hard comparison or before-and-after split to intensify believability.",
      "The result may rely too much on creator reaction rather than undeniable visible transformation.",
      "There may be limited support for long-lasting performance or wear experience."
    ],
    "skepticism_risk_note": "A skeptical viewer may still wonder whether the visible result is strong enough, whether it lasts, or whether it would work similarly on them."
  },
  "objection_handling_analysis": {
    "likely_objections": [
      "Will it feel greasy?",
      "Will it actually make a visible difference?",
      "Is this just another overhyped skincare product?",
      "Will it fit easily into my routine?"
    ],
    "objections_addressed": [
      "ease of use",
      "lightweight routine fit",
      "some degree of visible result"
    ],
    "objections_unaddressed": [
      "how strong or lasting the result is",
      "whether it is worth the price",
      "how it performs across different skin types"
    ],
    "handling_quality": "moderate",
    "timing_note": "The video handles ease and feel objections at the right time through demo, but deeper skepticism about real efficacy is only partially answered.",
    "specificity_note": "Reassurance feels natural rather than forced, but it remains more impressionistic than concrete."
  },
  "pacing_and_editing_analysis": {
    "pacing_quality": "strong",
    "product_reveal_timing": "early",
    "visual_variety_note": "The format likely keeps enough variety through face-to-camera, product-in-hand, application, and reaction shots without becoming chaotic.",
    "redundancy_note": "The structure appears efficient and not overly repetitive. Each section performs a distinct commercial job.",